ID,Type,Name,Contents,RewardType,Reward,Conversation,ProgressConversation,CompleteConversation
2001,1,골렘사냥,골렘잡기,1,100,큰일이에요.-마을 밖에 골렘이 나타났어요.-골렘을 잡아주세요.-퀘스트 골렘 5마리 잡기,골렘은 마을 밖에있어요.-골렘을 잡아주세요.,감사합니다.
2002,1,늑대사냥,늑대잡기,2,500,마을 밖에 늑대가 나타났어요.-늑대를 잡아주세요.-퀘스트 늑대 10마리 잡기,,
2003,1,드래곤 처치하기,드래곤 처치,1,500,드래곤이 마을을 습격했습니다.-드래곤을 잡고 마을을 구해주세요.-퀘스트 드래곤 처치하기,드래곤은 이 마을안쪽에 있습니다.,정말 드래곤을 처치하셨군요.-정말 감사합니다.
2004,4,도적 만나기,도적 만나기,1,300,도적은 마을 밖으로 나갔어요.-도적을 만나러 가주세요.-퀘스트 도적 만나기,도적을 만나야 합니다.,저는 도적입니다.-퀘스트 완료.
2005,4,경비병에게 말 걸기,경비병에게 다시 말을 걸어보자,2,5000,이 마을에는 처음오신건가요?-처음 오신 모험가에게 여비를 주고있습니다.-퀘스트 경비병에게 다시 말을 걸어보자,,5000골드를 드리겠습니다.
2006,4,상인 만나기,상인 Kachujin 만나기,2,500,마을에는 물건을 파는 상인이 있어요.-상인을 만나 거래를 해보시겠어요?-퀘스트 상인 Kachujin 만나기,,퀘스트 완료
2007,4,장비강화 시도,장비강화 시도하기,1,100,강해지기 위해서 장비 강화를 해보는건 어떨까요?-장비강화는 BlackSmith씨가 담당하고 있어요.-퀘스트 장비강화 시도하기,,
